{
  "catalog_id": "kilix-voice-res02-measured",
  "fixture_kind": "provider-catalog",
  "profiles": [
    {
      "artifact": {
        "artifact_id": "vosk-model-en-us-0.22-lgraph",
        "content_sha256": "d9838b4aaa82a75c4a17f5aca300eaca129aaab2a7cbf951bafbb500eb9c4334",
        "license_decision_id": null,
        "version": "0.22-lgraph"
      },
      "backend": "cpu",
      "evidence": {
        "command": "harness/res02_measure.py --arm lgraph-en-us --runs 5 --warmup 1 --label measured",
        "confidence": "measured",
        "fixture": "librispeech-dev-clean-84-121550-0014-clean",
        "measured_at": "2026-09-14T14:02:48.955839+00:00",
        "raw_evidence_sha256": "4ff037142014df81287230ab7e052f8a9e4d65281bb401e0b23ef386107953df",
        "reference_hardware_class": "h2-nvidia-rtx3070-8gib",
        "safety_margin_basis_points": 2000
      },
      "performance": {
        "first_result_ms": 1443.054,
        "realtime_factor": 0.809953,
        "tokens_per_second": null
      },
      "profile_id": "lgraph-en-us-cpu-res02",
      "provider": "kilix-voice",
      "qualification": "unqualified",
      "requirements": {
        "architecture": "x86_64",
        "disk_installed_bytes": 214028616,
        "download_bytes": 130557655,
        "ram_peak_bytes": 678653952,
        "temporary_bytes": null,
        "vram_peak_bytes": 0
      },
      "task": "stt",
      "version": "0.2.2"
    }
  ],
  "qualification_eligible": false,
  "schema": "plebian.models.profiles/v1"
}
