{
  "catalog_id": "kilix-voice-res02-measured",
  "fixture_kind": "provider-catalog",
  "profiles": [
    {
      "artifact": {
        "artifact_id": "vosk-model-small-en-us-0.15",
        "content_sha256": "30f26242c4eb449f948e42cb302dd7a686cb29a3423a8367f99ff41780942498",
        "license_decision_id": null,
        "version": "0.15"
      },
      "backend": "cpu",
      "evidence": {
        "command": "harness/res02_measure.py --arm small-en-us --runs 5 --warmup 1 --label measured",
        "confidence": "measured",
        "fixture": "librispeech-dev-clean-84-121550-0014-clean",
        "measured_at": "2026-09-14T14:02:25.166105+00:00",
        "raw_evidence_sha256": "4ff037142014df81287230ab7e052f8a9e4d65281bb401e0b23ef386107953df",
        "reference_hardware_class": "h2-nvidia-rtx3070-8gib",
        "safety_margin_basis_points": 2000
      },
      "performance": {
        "first_result_ms": 283.058,
        "realtime_factor": 0.180475,
        "tokens_per_second": null
      },
      "profile_id": "small-en-us-cpu-res02",
      "provider": "kilix-voice",
      "qualification": "unqualified",
      "requirements": {
        "architecture": "x86_64",
        "disk_installed_bytes": 70910667,
        "download_bytes": 41205931,
        "ram_peak_bytes": 266670080,
        "temporary_bytes": null,
        "vram_peak_bytes": 0
      },
      "task": "stt",
      "version": "0.2.2"
    }
  ],
  "qualification_eligible": false,
  "schema": "plebian.models.profiles/v1"
}
