{
  "catalog_id": "kilix-tts-auditions-2026-09-23",
  "fixture_kind": "provider-catalog",
  "profiles": [
    {
      "artifact": {
        "artifact_id": "piper-en-us-kristin-medium",
        "content_sha256": null,
        "license_decision_id": null,
        "version": "local-installed-2026-09-23"
      },
      "backend": "cpu",
      "evidence": {
        "command": "bench.py --kind piper --id piper-en-us-kristin-medium",
        "confidence": "measured",
        "fixture": "tts-short-sentence-first-plus-three-warm-v1",
        "measured_at": "2026-09-23T01:47:59.533895+00:00",
        "raw_evidence_sha256": "7e88fd1604802a50b4c19b88842455c7aa05f9eb7c48ced9d11ce1721238a49e",
        "reference_hardware_class": "x86_64-i7-9850h-cpu",
        "safety_margin_basis_points": 2000
      },
      "performance": {
        "first_result_ms": 3366.5551932062954,
        "realtime_factor": 0.08435291306013368,
        "tokens_per_second": null
      },
      "profile_id": "audition-piper-en-us-kristin-medium-20260923",
      "provider": "kilix-voice-interactive",
      "qualification": "unqualified",
      "requirements": {
        "architecture": "x86_64",
        "disk_installed_bytes": 63536347,
        "download_bytes": null,
        "ram_peak_bytes": 243564544,
        "temporary_bytes": null,
        "vram_peak_bytes": 0
      },
      "task": "tts",
      "version": "0.2.2-development"
    }
  ],
  "qualification_eligible": false,
  "schema": "plebian.models.profiles/v1"
}
