{
  "catalog_id": "kilix-tts-auditions-2026-09-23",
  "fixture_kind": "provider-catalog",
  "profiles": [
    {
      "artifact": {
        "artifact_id": "qwen3-tts-0.6b-customvoice",
        "content_sha256": null,
        "license_decision_id": null,
        "version": "local-installed-2026-09-23"
      },
      "backend": "cuda",
      "evidence": {
        "command": "bench.py --kind qwen --id qwen3-tts-0.6b-customvoice-cuda",
        "confidence": "measured",
        "fixture": "tts-short-sentence-first-plus-three-warm-v1",
        "measured_at": "2026-09-23T01:51:43.490640+00:00",
        "raw_evidence_sha256": "3fc393b4822a21dfed6c4a5ec0481f92cf6add06d82e3c3a77b4e3cec7216c71",
        "reference_hardware_class": "x86_64-i7-10700f-rtx3070-8gib",
        "safety_margin_basis_points": 2000
      },
      "performance": {
        "first_result_ms": 34128.85456706863,
        "realtime_factor": 3.2582930821637786,
        "tokens_per_second": null
      },
      "profile_id": "audition-qwen3-tts-0.6b-customvoice-cuda-20260923",
      "provider": "kilix-voice-interactive",
      "qualification": "unqualified",
      "requirements": {
        "architecture": "x86_64",
        "disk_installed_bytes": 2498388392,
        "download_bytes": null,
        "ram_peak_bytes": 2691829760,
        "temporary_bytes": null,
        "vram_peak_bytes": 2606759936
      },
      "task": "tts",
      "version": "0.2.2-development"
    }
  ],
  "qualification_eligible": false,
  "schema": "plebian.models.profiles/v1"
}
